{
  "coordinate_frame": "map",
  "edges": [
    {
      "constraints": {
        "allow_reverse": false,
        "allow_stop": true,
        "max_curvature_abs": 0.35,
        "max_speed_mps": 1.0,
        "min_speed_mps": 0.3
      },
      "cost": 1.982,
      "direction": "forward",
      "from": "N0001",
      "id": "E_C-001_F",
      "length_m": 1.982,
      "reference_points": [
        {
          "behavior": "follow",
          "kappa": -0.047082,
          "s_m": 0.0,
          "v_mps": 1.0,
          "x": 0.554,
          "y": 1.473,
          "yaw": -0.9178
        },
        {
          "behavior": "follow",
          "kappa": -0.047082,
          "s_m": 0.2,
          "v_mps": 1.0,
          "x": 0.676,
          "y": 1.314,
          "yaw": -0.9366
        },
        {
          "behavior": "follow",
          "kappa": -0.002899,
          "s_m": 0.4,
          "v_mps": 1.0,
          "x": 0.794,
          "y": 1.153,
          "yaw": -0.9378
        },
        {
          "behavior": "follow",
          "kappa": 0.046192,
          "s_m": 0.6,
          "v_mps": 1.0,
          "x": 0.913,
          "y": 0.991,
          "yaw": -0.9193
        },
        {
          "behavior": "follow",
          "kappa": 0.100749,
          "s_m": 0.8,
          "v_mps": 1.0,
          "x": 1.034,
          "y": 0.832,
          "yaw": -0.879
        },
        {
          "behavior": "follow",
          "kappa": 0.160284,
          "s_m": 1.0,
          "v_mps": 1.0,
          "x": 1.162,
          "y": 0.678,
          "yaw": -0.8149
        },
        {
          "behavior": "follow",
          "kappa": 0.221334,
          "s_m": 1.2,
          "v_mps": 1.0,
          "x": 1.299,
          "y": 0.533,
          "yaw": -0.7265
        },
        {
          "behavior": "follow",
          "kappa": 0.27583,
          "s_m": 1.4,
          "v_mps": 1.0,
          "x": 1.448,
          "y": 0.4,
          "yaw": -0.6164
        },
        {
          "behavior": "follow",
          "kappa": 0.31193,
          "s_m": 1.6,
          "v_mps": 1.0,
          "x": 1.611,
          "y": 0.284,
          "yaw": -0.492
        },
        {
          "behavior": "follow",
          "kappa": 0.314606,
          "s_m": 1.8,
          "v_mps": 1.0,
          "x": 1.787,
          "y": 0.19,
          "yaw": -0.372
        },
        {
          "behavior": "follow",
          "kappa": 0.314606,
          "s_m": 1.982,
          "v_mps": 1.0,
          "x": 1.957,
          "y": 0.124,
          "yaw": -0.372
        }
      ],
      "source_path_id": "C-001",
      "speed_limit_mps": 1.0,
      "to": "N0002",
      "validation": {
        "curvature_ok": true,
        "drivable_area_ok": true,
        "footprint_ok": true,
        "no_go_area_ok": true
      },
      "waypoint_range": {
        "end_index": 10,
        "start_index": 0
      }
    },
    {
      "constraints": {
        "allow_reverse": false,
        "allow_stop": true,
        "max_curvature_abs": 0.35,
        "max_speed_mps": 1.0,
        "min_speed_mps": 0.3
      },
      "cost": 3.48,
      "direction": "forward",
      "from": "N0002",
      "id": "E_L-001_F",
      "length_m": 3.48,
      "reference_points": [
        {
          "behavior": "follow",
          "kappa": 0.0,
          "s_m": 0.0,
          "v_mps": 1.0,
          "x": 1.957,
          "y": 0.124,
          "yaw": 0.0
        },
        {
          "behavior": "follow",
          "kappa": 0.0,
          "s_m": 0.2,
          "v_mps": 1.0,
          "x": 2.157,
          "y": 0.124,
          "yaw": 0.0
        },
        {
          "behavior": "follow",
          "kappa": 0.0,
          "s_m": 0.4,
          "v_mps": 1.0,
          "x": 2.357,
          "y": 0.124,
          "yaw": 0.0
        },
        {
          "behavior": "follow",
          "kappa": 0.0,
          "s_m": 0.6,
          "v_mps": 1.0,
          "x": 2.557,
          "y": 0.124,
          "yaw": 0.0
        },
        {
          "behavior": "follow",
          "kappa": 0.0,
          "s_m": 0.8,
          "v_mps": 1.0,
          "x": 2.757,
          "y": 0.124,
          "yaw": 0.0
        },
        {
          "behavior": "follow",
          "kappa": 0.0,
          "s_m": 1.0,
          "v_mps": 1.0,
          "x": 2.957,
          "y": 0.124,
          "yaw": 0.0
        },
        {
          "behavior": "follow",
          "kappa": 0.0,
          "s_m": 1.2,
          "v_mps": 1.0,
          "x": 3.157,
          "y": 0.124,
          "yaw": 0.0
        },
        {
          "behavior": "follow",
          "kappa": 0.0,
          "s_m": 1.4,
          "v_mps": 1.0,
          "x": 3.357,
          "y": 0.124,
          "yaw": 0.0
        },
        {
          "behavior": "follow",
          "kappa": 0.0,
          "s_m": 1.6,
          "v_mps": 1.0,
          "x": 3.557,
          "y": 0.124,
          "yaw": 0.0
        },
        {
          "behavior": "follow",
          "kappa": 0.0,
          "s_m": 1.8,
          "v_mps": 1.0,
          "x": 3.757,
          "y": 0.124,
          "yaw": 0.0
        },
        {
          "behavior": "follow",
          "kappa": 0.0,
          "s_m": 2.0,
          "v_mps": 1.0,
          "x": 3.957,
          "y": 0.124,
          "yaw": 0.0
        },
        {
          "behavior": "follow",
          "kappa": 0.0,
          "s_m": 2.2,
          "v_mps": 1.0,
          "x": 4.157,
          "y": 0.124,
          "yaw": 0.0
        },
        {
          "behavior": "follow",
          "kappa": 0.0,
          "s_m": 2.4,
          "v_mps": 1.0,
          "x": 4.357,
          "y": 0.124,
          "yaw": 0.0
        },
        {
          "behavior": "follow",
          "kappa": 0.0,
          "s_m": 2.6,
          "v_mps": 1.0,
          "x": 4.557,
          "y": 0.124,
          "yaw": 0.0
        },
        {
          "behavior": "follow",
          "kappa": 0.0,
          "s_m": 2.8,
          "v_mps": 1.0,
          "x": 4.757,
          "y": 0.124,
          "yaw": 0.0
        },
        {
          "behavior": "follow",
          "kappa": 0.0,
          "s_m": 3.0,
          "v_mps": 1.0,
          "x": 4.957,
          "y": 0.124,
          "yaw": 0.0
        },
        {
          "behavior": "follow",
          "kappa": 0.0,
          "s_m": 3.2,
          "v_mps": 1.0,
          "x": 5.157,
          "y": 0.124,
          "yaw": 0.0
        },
        {
          "behavior": "follow",
          "kappa": 0.0,
          "s_m": 3.4,
          "v_mps": 1.0,
          "x": 5.357,
          "y": 0.124,
          "yaw": 0.0
        },
        {
          "behavior": "follow",
          "kappa": 0.0,
          "s_m": 3.48,
          "v_mps": 1.0,
          "x": 5.436,
          "y": 0.124,
          "yaw": 0.0
        }
      ],
      "source_path_id": "L-001",
      "speed_limit_mps": 1.0,
      "to": "N0003",
      "validation": {
        "curvature_ok": true,
        "drivable_area_ok": true,
        "footprint_ok": true,
        "no_go_area_ok": true
      },
      "waypoint_range": {
        "end_index": 29,
        "start_index": 11
      }
    },
    {
      "constraints": {
        "allow_reverse": false,
        "allow_stop": true,
        "max_curvature_abs": 0.35,
        "max_speed_mps": 1.0,
        "min_speed_mps": 0.3
      },
      "cost": 2.787,
      "direction": "forward",
      "from": "N0003",
      "id": "E_C-002_F",
      "length_m": 2.787,
      "reference_points": [
        {
          "behavior": "follow",
          "kappa": 0.166201,
          "s_m": 0.0,
          "v_mps": 1.0,
          "x": 5.436,
          "y": 0.124,
          "yaw": 0.7445
        },
        {
          "behavior": "follow",
          "kappa": 0.166201,
          "s_m": 0.2,
          "v_mps": 1.0,
          "x": 5.584,
          "y": 0.259,
          "yaw": 0.8109
        },
        {
          "behavior": "follow",
          "kappa": 0.201582,
          "s_m": 0.4,
          "v_mps": 1.0,
          "x": 5.721,
          "y": 0.404,
          "yaw": 0.8915
        },
        {
          "behavior": "follow",
          "kappa": 0.243285,
          "s_m": 0.6,
          "v_mps": 1.0,
          "x": 5.847,
          "y": 0.56,
          "yaw": 0.9887
        },
        {
          "behavior": "follow",
          "kappa": 0.287817,
          "s_m": 0.8,
          "v_mps": 1.0,
          "x": 5.957,
          "y": 0.727,
          "yaw": 1.1035
        },
        {
          "behavior": "follow",
          "kappa": 0.327117,
          "s_m": 1.0,
          "v_mps": 1.0,
          "x": 6.047,
          "y": 0.905,
          "yaw": 1.234
        },
        {
          "behavior": "follow",
          "kappa": 0.349223,
          "s_m": 1.2,
          "v_mps": 1.0,
          "x": 6.113,
          "y": 1.094,
          "yaw": 1.3733
        },
        {
          "behavior": "follow",
          "kappa": 0.344614,
          "s_m": 1.399,
          "v_mps": 1.0,
          "x": 6.152,
          "y": 1.29,
          "yaw": 1.5107
        },
        {
          "behavior": "follow",
          "kappa": 0.313859,
          "s_m": 1.599,
          "v_mps": 1.0,
          "x": 6.164,
          "y": 1.489,
          "yaw": 1.6359
        },
        {
          "behavior": "follow",
          "kappa": 0.267125,
          "s_m": 1.799,
          "v_mps": 1.0,
          "x": 6.151,
          "y": 1.689,
          "yaw": 1.7426
        },
        {
          "behavior": "follow",
          "kappa": 0.21652,
          "s_m": 1.999,
          "v_mps": 1.0,
          "x": 6.117,
          "y": 1.886,
          "yaw": 1.8291
        },
        {
          "behavior": "follow",
          "kappa": 0.169809,
          "s_m": 2.199,
          "v_mps": 1.0,
          "x": 6.066,
          "y": 2.079,
          "yaw": 1.8969
        },
        {
          "behavior": "follow",
          "kappa": 0.130066,
          "s_m": 2.399,
          "v_mps": 1.0,
          "x": 6.002,